{
  "version": 2,
  "description": "API-backed ATS sources. The scanner normalizes provider-specific records into one job schema and repairs derivable source fields in memory.",
  "source_schema": {
    "common": ["company", "provider"],
    "greenhouse": ["slug", "api_url (optional)"],
    "lever": ["slug", "region (optional: global or eu)", "api_url (optional)"],
    "ashby": ["slug or job_board_name", "api_url (optional)"],
    "workday": ["career_url or api_url", "host (optional)", "tenant (optional)", "site (optional)"]
  },
  "sources": [
    {"company": "Airbnb", "provider": "greenhouse", "slug": "airbnb", "api_url": "https://boards-api.greenhouse.io/v1/boards/airbnb/jobs"},
    {"company": "Anthropic", "provider": "greenhouse", "slug": "anthropic", "api_url": "https://boards-api.greenhouse.io/v1/boards/anthropic/jobs"},
    {"company": "Atlassian", "provider": "greenhouse", "slug": "atlassian", "api_url": "https://boards-api.greenhouse.io/v1/boards/atlassian/jobs"},
    {"company": "Check Point", "provider": "lever", "slug": "checkpoint", "api_url": "https://api.lever.co/v0/postings/checkpoint?mode=json"},
    {"company": "Cloudflare", "provider": "greenhouse", "slug": "cloudflare", "api_url": "https://boards-api.greenhouse.io/v1/boards/cloudflare/jobs"},
    {"company": "Cohere", "provider": "ashby", "slug": "cohere", "api_url": "https://api.ashbyhq.com/posting-api/job-board/cohere"},
    {"company": "CrowdStrike", "provider": "greenhouse", "slug": "crowdstrike", "api_url": "https://boards-api.greenhouse.io/v1/boards/crowdstrike/jobs"},
    {"company": "Databricks", "provider": "greenhouse", "slug": "databricks", "api_url": "https://boards-api.greenhouse.io/v1/boards/databricks/jobs"},
    {"company": "Dropbox", "provider": "greenhouse", "slug": "dropbox", "api_url": "https://boards-api.greenhouse.io/v1/boards/dropbox/jobs"},
    {"company": "Elastic", "provider": "greenhouse", "slug": "elastic", "api_url": "https://boards-api.greenhouse.io/v1/boards/elastic/jobs"},
    {"company": "Fortinet", "provider": "lever", "slug": "fortinet", "api_url": "https://api.lever.co/v0/postings/fortinet?mode=json"},
    {"company": "GitLab", "provider": "greenhouse", "slug": "gitlab", "api_url": "https://boards-api.greenhouse.io/v1/boards/gitlab/jobs"},
    {"company": "HashiCorp", "provider": "greenhouse", "slug": "hashicorp", "api_url": "https://boards-api.greenhouse.io/v1/boards/hashicorp/jobs"},
    {"company": "Hugging Face", "provider": "greenhouse", "slug": "huggingface", "api_url": "https://boards-api.greenhouse.io/v1/boards/huggingface/jobs"},
    {"company": "LangChain", "provider": "lever", "slug": "langchain", "api_url": "https://api.lever.co/v0/postings/langchain?mode=json"},
    {"company": "Mistral AI", "provider": "lever", "slug": "mistral", "api_url": "https://api.lever.co/v0/postings/mistral?mode=json"},
    {"company": "MongoDB", "provider": "greenhouse", "slug": "mongodb", "api_url": "https://boards-api.greenhouse.io/v1/boards/mongodb/jobs"},
    {"company": "NVIDIA", "provider": "workday", "host": "nvidia.wd5.myworkdayjobs.com", "tenant": "nvidia", "site": "NVIDIAExternalCareerSite", "career_url": "https://nvidia.wd5.myworkdayjobs.com/NVIDIAExternalCareerSite"},
    {"company": "Netflix", "provider": "lever", "slug": "netflix", "api_url": "https://api.lever.co/v0/postings/netflix?mode=json"},
    {"company": "Netlify", "provider": "greenhouse", "slug": "netlify", "api_url": "https://boards-api.greenhouse.io/v1/boards/netlify/jobs"},
    {"company": "Okta", "provider": "greenhouse", "slug": "okta", "api_url": "https://boards-api.greenhouse.io/v1/boards/okta/jobs"},
    {"company": "OpenAI", "provider": "greenhouse", "slug": "openai", "api_url": "https://boards-api.greenhouse.io/v1/boards/openai/jobs"},
    {"company": "Palo Alto Networks", "provider": "greenhouse", "slug": "paloaltonetworks", "api_url": "https://boards-api.greenhouse.io/v1/boards/paloaltonetworks/jobs"},
    {"company": "Perplexity AI", "provider": "ashby", "slug": "Perplexity", "api_url": "https://api.ashbyhq.com/posting-api/job-board/Perplexity"},
    {"company": "Pure Storage", "provider": "greenhouse", "slug": "purestorage", "api_url": "https://boards-api.greenhouse.io/v1/boards/purestorage/jobs"},
    {"company": "Redis", "provider": "lever", "slug": "redis", "api_url": "https://api.lever.co/v0/postings/redis?mode=json"},
    {"company": "SentinelOne", "provider": "greenhouse", "slug": "sentinelone", "api_url": "https://boards-api.greenhouse.io/v1/boards/sentinelone/jobs"},
    {"company": "Shopify", "provider": "greenhouse", "slug": "shopify", "api_url": "https://boards-api.greenhouse.io/v1/boards/shopify/jobs"},
    {"company": "Spotify", "provider": "lever", "slug": "spotify", "api_url": "https://api.lever.co/v0/postings/spotify?mode=json"},
    {"company": "Stripe", "provider": "greenhouse", "slug": "stripe", "api_url": "https://boards-api.greenhouse.io/v1/boards/stripe/jobs"},
    {"company": "Vercel", "provider": "greenhouse", "slug": "vercel", "api_url": "https://boards-api.greenhouse.io/v1/boards/vercel/jobs"},
    {"company": "Zoom", "provider": "lever", "slug": "zoom", "api_url": "https://api.lever.co/v0/postings/zoom?mode=json"},
    {"company": "Zscaler", "provider": "greenhouse", "slug": "zscaler", "api_url": "https://boards-api.greenhouse.io/v1/boards/zscaler/jobs"},
    {"company": "PhonePe", "provider": "greenhouse", "slug": "phonepe", "api_url": "https://boards-api.greenhouse.io/v1/boards/phonepe/jobs"},
    {"company": "Coinbase", "provider": "greenhouse", "slug": "coinbase", "api_url": "https://boards-api.greenhouse.io/v1/boards/coinbase/jobs"},
    {"company": "Rubrik", "provider": "greenhouse", "slug": "rubrik", "api_url": "https://boards-api.greenhouse.io/v1/boards/rubrik/jobs"},
    {"company": "Samsara", "provider": "greenhouse", "slug": "samsara", "api_url": "https://boards-api.greenhouse.io/v1/boards/samsara/jobs"},
    {"company": "Postman", "provider": "greenhouse", "slug": "postman", "api_url": "https://boards-api.greenhouse.io/v1/boards/postman/jobs"},
    {"company": "Figma", "provider": "greenhouse", "slug": "figma", "api_url": "https://boards-api.greenhouse.io/v1/boards/figma/jobs"},
    {"company": "Datadog", "provider": "greenhouse", "slug": "datadog", "api_url": "https://boards-api.greenhouse.io/v1/boards/datadog/jobs"},
    {"company": "Asana", "provider": "greenhouse", "slug": "asana", "api_url": "https://boards-api.greenhouse.io/v1/boards/asana/jobs"},
    {"company": "Scale AI", "provider": "greenhouse", "slug": "scaleai", "api_url": "https://boards-api.greenhouse.io/v1/boards/scaleai/jobs"},
    {"company": "Mercury", "provider": "greenhouse", "slug": "mercury", "api_url": "https://boards-api.greenhouse.io/v1/boards/mercury/jobs"},
    {"company": "Brex", "provider": "greenhouse", "slug": "brex", "api_url": "https://boards-api.greenhouse.io/v1/boards/brex/jobs"},
    {"company": "Instabase", "provider": "greenhouse", "slug": "instabase", "api_url": "https://boards-api.greenhouse.io/v1/boards/instabase/jobs"},
    {"company": "Glean", "provider": "greenhouse", "slug": "gleanwork", "api_url": "https://boards-api.greenhouse.io/v1/boards/gleanwork/jobs"},
    {"company": "ClickHouse", "provider": "greenhouse", "slug": "clickhouse", "api_url": "https://boards-api.greenhouse.io/v1/boards/clickhouse/jobs"},
    {"company": "Sourcegraph", "provider": "greenhouse", "slug": "sourcegraph91", "api_url": "https://boards-api.greenhouse.io/v1/boards/sourcegraph91/jobs"},
    {"company": "HackerRank", "provider": "greenhouse", "slug": "hackerrank", "api_url": "https://boards-api.greenhouse.io/v1/boards/hackerrank/jobs"},
    {"company": "Groww", "provider": "greenhouse", "slug": "groww", "api_url": "https://boards-api.greenhouse.io/v1/boards/groww/jobs"}
  ]
}
